
CONFRONT	DIFFERENCE	BRASILIA	PURITY-TO-HARMONY	1	"I don’t trust these aliens, and neither should you. We have no idea what they're capable of."
CONFRONT	DIFFERENCE	POLYSTRALIA	PURITY-TO-HARMONY	1	"People are what's important, not these aliens. You can't love an alien, now can you?"
CONFRONT	DIFFERENCE	POLYSTRALIA	PURITY-TO-HARMONY	2	"You sure do like them buggers, don't you?"
CONFRONT	DIFFERENCE	RUSSIA	PURITY-TO-HARMONY	1	"Aliens do not understand your humanity. You will regret losing your heritage."
DISCUSS-AGREEMENTS	AL-FALAH	PURITY-TO-HARMONY	1	"If you'll accept some of the humanity you've lost, we are happy to trade."
RELATIONSHIP	INTRO	ARC	PURITY-TO-HARMONY	1	"You're not going to persuade us to join your cause. The 'A' in ARC stands for American, not Alien."